{
  "type": "object",
  "$schema": "http://json-schema.org/draft-04/schema#",
  "description": "Resource event body",
  "properties": {
    "id": {
      "description": "Resource id",
      "type": "string"
    },
    "type": {
      "description": "Resource event operation type",
      "$ref": "resourceEventType.json"
    },
    "deleteEventSubType": {
      "description": "Resource event delete operation type",
      "$ref": "resourceDeleteEventSubType.json"
    },
    "tenant": {
      "description": "Tenant id",
      "type": "string"
    },
    "resourceName": {
      "description": "Name of resource",
      "type": "string"
    },
    "new": {
      "description": "Instance record new fields",
      "type": "object"
    },
    "old": {
      "description": "Instance record old fields",
      "type": "object"
    }
  }
}
